<?xml version="1.0" encoding="UTF-8"?>
<root xmlns="hospital"
      xmlns:xsi="http://www.w3.org/2001/XMLSchema-instance"
      xsi:schemaLocation="hospital schema.xsd">
<hospital>
    <address>Minsk</address>
    <DEPARTMENTS>
        <department>
            <DOCTORS>
                <doctor>
                    <name>Denis</name>
                    <age>44</age>
                    <weight>88</weight>
                    <spec>dentist</spec>
                </doctor>
                <doctor>
                    <name>Denis</name>
                    <age>44</age>
                    <weight>88</weight>
                    <spec>dentist</spec>
                </doctor>
            </DOCTORS>
            <name>DENTAL</name>
        </department>
        <department>
            <DOCTORS>
                <doctor>
                    <name>Sergey</name>
                    <age>66</age>
                    <weight>77</weight>
                    <spec>surgeon</spec>
                </doctor>
                <doctor>
                    <name>Sergey</name>
                    <age>66</age>
                    <weight>77</weight>
                    <spec>surgeon</spec>
                </doctor>
            </DOCTORS>
            <name>SURGERY</name>
        </department>
    </DEPARTMENTS>
    <PATIENTS>
        <patient>
            <name>Alex</name>
            <age>33</age>
            <weight>66</weight>
        </patient>
        <patient>
            <name>Alex</name>
            <age>33</age>
            <weight>66</weight>
        </patient>
    </PATIENTS>
</hospital>
</root>
